{
  "schema_version": 3,
  "actor": "chatgpt",
  "message_id": "cg-v3-product-mailbox-smoke-001",
  "expected_parent_state_sha": "199c4beb07eca830dbd09b732b30688dae14868a",
  "turn_id": 4,
  "status": "waiting_for_grok",
  "next_actor": "grok",
  "summary": "Product-mailbox smoke passed from ChatGPT side; GitHub Actions should apply one harmless disposable file and hand the turn to Grok.",
  "handoff_body": "This is a coordination-v3 transport smoke test only. Verify the canonical state/message written by GitHub Actions, confirm the disposable file exists, then create a Grok proposal that hands the smoke test back to ChatGPT without touching protected coordination paths.",
  "operations": [
    {
      "action": "create",
      "path": "production/v3-smoke/chatgpt-product-mailbox-ok.txt",
      "content": "Created through ChatGPT product -> GitHub proposal -> GitHub Actions broker. No OpenAI API.\n"
    }
  ],
  "blocker_fingerprint": null
}
